GO Term	Description	P-value	FDR q-value	Enrichment	N	B	n	b	Genes
GO:0016043	cellular component organization	0.000475	0.1	1.17	13973	3968	933	310	[ZMYND8  -  zinc finger, mynd-type containing 8, A2M  -  alpha-2-macroglobulin, DST  -  dystonin, SPTA1  -  spectrin, alpha, erythrocytic 1 (elliptocytosis 2), BNIP3  -  bcl2/adenovirus e1b 19kda interacting protein 3, G3BP1  -  gtpase activating protein (sh3 domain) binding protein 1, SPIRE1  -  spire actin nucleation factor 1, ABLIM1  -  actin binding lim protein 1, ABCA1  -  atp-binding cassette, sub-family a (abc1), member 1, CORO1C  -  coronin, actin binding protein, 1c, NAP1L3  -  nucleosome assembly protein 1-like 3, NAP1L2  -  nucleosome assembly protein 1-like 2, DENND1A  -  denn/madd domain containing 1a, RTN3  -  reticulon 3, EPHA2  -  eph receptor a2, TTR  -  transthyretin, BLCAP  -  bladder cancer associated protein, RLF  -  rearranged l-myc fusion, TUBB2A  -  tubulin, beta 2a class iia, SOX15  -  sry (sex determining region y)-box 15, PADI4  -  peptidyl arginine deiminase, type iv, MYOD1  -  myogenic differentiation 1, NPHP4  -  nephronophthisis 4, TET3  -  tet methylcytosine dioxygenase 3, TMOD4  -  tropomodulin 4 (muscle), SYTL1  -  synaptotagmin-like 1, PLEC  -  plectin, CREB1  -  camp responsive element binding protein 1, BRE  -  brain and reproductive organ-expressed (tnfrsf1a modulator), EIF5  -  eukaryotic translation initiation factor 5, DOCK10  -  dedicator of cytokinesis 10, MAST1  -  microtubule associated serine/threonine kinase 1, TRDN  -  triadin, LMAN1  -  lectin, mannose-binding, 1, PRDX3  -  peroxiredoxin 3, ADAMTS4  -  adam metallopeptidase with thrombospondin type 1 motif, 4, KRT31  -  keratin 31, GABARAPL1  -  gaba(a) receptor-associated protein like 1, DYSF  -  dysferlin, limb girdle muscular dystrophy 2b (autosomal recessive), SNCG  -  synuclein, gamma (breast cancer-specific protein 1), FMNL1  -  formin-like 1, TBPL1  -  tbp-like 1, SQSTM1  -  sequestosome 1, MYH9  -  myosin, heavy chain 9, non-muscle, DBNDD1  -  dysbindin (dystrobrevin binding protein 1) domain containing 1, ARID1A  -  at rich interactive domain 1a (swi-like), LIMCH1  -  lim and calponin homology domains 1, APOOL  -  apolipoprotein o-like, EGFR  -  epidermal growth factor receptor, PANX3  -  pannexin 3, GCLM  -  glutamate-cysteine ligase, modifier subunit, SNCB  -  synuclein, beta, SYT2  -  synaptotagmin ii, CCDC103  -  coiled-coil domain containing 103, CDC45  -  cell division cycle 45, FZD4  -  frizzled family receptor 4, TMCC1  -  transmembrane and coiled-coil domain family 1, MYBPH  -  myosin binding protein h, TCF7L1  -  transcription factor 7-like 1 (t-cell specific, hmg-box), KRT18  -  keratin 18, LAMP2  -  lysosomal-associated membrane protein 2, KIRREL3  -  kin of irre like 3 (drosophila), ADD3  -  adducin 3 (gamma), FNBP1  -  formin binding protein 1, SYT6  -  synaptotagmin vi, SMARCD1  -  swi/snf related, matrix associated, actin dependent regulator of chromatin, subfamily d, member 1, HSP90AB1  -  heat shock protein 90kda alpha (cytosolic), class b member 1, COL4A5  -  collagen, type iv, alpha 5, KCTD9  -  potassium channel tetramerization domain containing 9, REPS1  -  ralbp1 associated eps domain containing 1, SMARCA2  -  swi/snf related, matrix associated, actin dependent regulator of chromatin, subfamily a, member 2, LCP1  -  lymphocyte cytosolic protein 1 (l-plastin), HSPG2  -  heparan sulfate proteoglycan 2, TRIM37  -  tripartite motif containing 37, PDZD7  -  pdz domain containing 7, COL12A1  -  collagen, type xii, alpha 1, COL27A1  -  collagen, type xxvii, alpha 1, COL11A1  -  collagen, type xi, alpha 1, LAMA3  -  laminin, alpha 3, COL10A1  -  collagen, type x, alpha 1, PAK6  -  p21 protein (cdc42/rac)-activated kinase 6, LAMC1  -  laminin, gamma 1 (formerly lamb2), LAMB1  -  laminin, beta 1, AKT3  -  v-akt murine thymoma viral oncogene homolog 3, CAPN6  -  calpain 6, AP1G1  -  adaptor-related protein complex 1, gamma 1 subunit, FRMD3  -  ferm domain containing 3, UTRN  -  utrophin, KCNS3  -  potassium voltage-gated channel, delayed-rectifier, subfamily s, member 3, HRNR  -  hornerin, COL14A1  -  collagen, type xiv, alpha 1, NFASC  -  neurofascin, SVIL  -  supervillin, SETD3  -  set domain containing 3, KCNMA1  -  potassium large conductance calcium-activated channel, subfamily m, alpha member 1, CTSG  -  cathepsin g, XIRP1  -  xin actin-binding repeat containing 1, KDM6B  -  lysine (k)-specific demethylase 6b, MAST2  -  microtubule associated serine/threonine kinase 2, NRG1  -  neuregulin 1, BSCL2  -  berardinelli-seip congenital lipodystrophy 2 (seipin), TUBA1C  -  tubulin, alpha 1c, UBE2K  -  ubiquitin-conjugating enzyme e2k, ALDH5A1  -  aldehyde dehydrogenase 5 family, member a1, VCP  -  valosin containing protein, STK11  -  serine/threonine kinase 11, PEX16  -  peroxisomal biogenesis factor 16, STK4  -  serine/threonine kinase 4, MSN  -  moesin, MRPL37  -  mitochondrial ribosomal protein l37, MICU1  -  mitochondrial calcium uptake 1, UBC  -  ubiquitin c, ALDOA  -  aldolase a, fructose-bisphosphate, SSH3  -  slingshot protein phosphatase 3, ADRM1  -  adhesion regulating molecule 1, PRPF40A  -  prp40 pre-mrna processing factor 40 homolog a (s. cerevisiae), FAF2  -  fas associated factor family member 2, ZFYVE9  -  zinc finger, fyve domain containing 9, EPB41L1  -  erythrocyte membrane protein band 4.1-like 1, EPB41  -  erythrocyte membrane protein band 4.1 (elliptocytosis 1, rh-linked), SRPK1  -  srsf protein kinase 1, TUSC5  -  tumor suppressor candidate 5, MMP20  -  matrix metallopeptidase 20, EPHB2  -  eph receptor b2, PLCE1  -  phospholipase c, epsilon 1, EPHA4  -  eph receptor a4, RYR1  -  ryanodine receptor 1 (skeletal), TUBGCP3  -  tubulin, gamma complex associated protein 3, BCAN  -  brevican, SMCR7  -  smith-magenis syndrome chromosome region, candidate 7, TBC1D1  -  tbc1 (tre-2/usp6, bub2, cdc16) domain family, member 1, GAPDH  -  glyceraldehyde-3-phosphate dehydrogenase, CLIP1  -  cap-gly domain containing linker protein 1, HMGA1  -  high mobility group at-hook 1, ANXA1  -  annexin a1, ADAM12  -  adam metallopeptidase domain 12, RTN4  -  reticulon 4, AIFM2  -  apoptosis-inducing factor, mitochondrion-associated, 2, TRPM6  -  transient receptor potential cation channel, subfamily m, member 6, CCK  -  cholecystokinin, TNFRSF9  -  tumor necrosis factor receptor superfamily, member 9, SSH1  -  slingshot protein phosphatase 1, FN1  -  fibronectin 1, SMC6  -  structural maintenance of chromosomes 6, MITF  -  microphthalmia-associated transcription factor, GSN  -  gelsolin, SEC24D  -  sec24 family, member d (s. cerevisiae), GADD45A  -  growth arrest and dna-damage-inducible, alpha, MID1  -  midline 1 (opitz/bbb syndrome), VANGL2  -  vangl planar cell polarity protein 2, SDC4  -  syndecan 4, ANXA7  -  annexin a7, DCTN1  -  dynactin 1, PTPN23  -  protein tyrosine phosphatase, non-receptor type 23, PSD  -  pleckstrin and sec7 domain containing, CLIC4  -  chloride intracellular channel 4, FLNC  -  filamin c, gamma, PACSIN2  -  protein kinase c and casein kinase substrate in neurons 2, APBA1  -  amyloid beta (a4) precursor protein-binding, family a, member 1, CDA  -  cytidine deaminase, LARP4  -  la ribonucleoprotein domain family, member 4, SMYD3  -  set and mynd domain containing 3, CD47  -  cd47 molecule, PADI3  -  peptidyl arginine deiminase, type iii, CHEK2  -  checkpoint kinase 2, CAB39  -  calcium binding protein 39, TBC1D4  -  tbc1 domain family, member 4, PAFAH1B1  -  platelet-activating factor acetylhydrolase 1b, regulatory subunit 1 (45kda), OMG  -  oligodendrocyte myelin glycoprotein, MMP19  -  matrix metallopeptidase 19, SETD5  -  set domain containing 5, IL6  -  interleukin 6 (interferon, beta 2), PDGFA  -  platelet-derived growth factor alpha polypeptide, ITGA5  -  integrin, alpha 5 (fibronectin receptor, alpha polypeptide), PSMD11  -  proteasome (prosome, macropain) 26s subunit, non-atpase, 11, CNTNAP2  -  contactin associated protein-like 2, MRPS16  -  mitochondrial ribosomal protein s16, ATG9B  -  autophagy related 9b, DCTN2  -  dynactin 2 (p50), TEKT3  -  tektin 3, GLRX3  -  glutaredoxin 3, PDGFRB  -  platelet-derived growth factor receptor, beta polypeptide, ME1  -  malic enzyme 1, nadp(+)-dependent, cytosolic, ITGA2B  -  integrin, alpha 2b (platelet glycoprotein iib of iib/iiia complex, antigen cd41), FAM83H  -  family with sequence similarity 83, member h, MADD  -  map-kinase activating death domain, NUP98  -  nucleoporin 98kda, CDC14A  -  cell division cycle 14a, L3MBTL1  -  l(3)mbt-like 1 (drosophila), ATL1  -  atlastin gtpase 1, DCLK1  -  doublecortin-like kinase 1, BAZ2A  -  bromodomain adjacent to zinc finger domain, 2a, RHOG  -  ras homolog family member g, BBS9  -  bardet-biedl syndrome 9, PRDM2  -  pr domain containing 2, with znf domain, ARAP3  -  arfgap with rhogap domain, ankyrin repeat and ph domain 3, LRRC55  -  leucine rich repeat containing 55, TBL1X  -  transducin (beta)-like 1x-linked, MET  -  met proto-oncogene, MPP5  -  membrane protein, palmitoylated 5 (maguk p55 subfamily member 5), S100A10  -  s100 calcium binding protein a10, CNTN4  -  contactin 4, USO1  -  uso1 vesicle transport factor, CDH8  -  cadherin 8, type 2, RB1CC1  -  rb1-inducible coiled-coil 1, CDH12  -  cadherin 12, type 2 (n-cadherin 2), NRD1  -  nardilysin (n-arginine dibasic convertase), MGST1  -  microsomal glutathione s-transferase 1, ZNF207  -  zinc finger protein 207, PTPRF  -  protein tyrosine phosphatase, receptor type, f, CDH17  -  cadherin 17, li cadherin (liver-intestine), CHD9  -  chromodomain helicase dna binding protein 9, RABEP1  -  rabaptin, rab gtpase binding effector protein 1, TIMP2  -  timp metallopeptidase inhibitor 2, CRB1  -  crumbs homolog 1 (drosophila), ITGB3BP  -  integrin beta 3 binding protein (beta3-endonexin), EPC2  -  enhancer of polycomb homolog 2 (drosophila), RUFY3  -  run and fyve domain containing 3, SLC6A4  -  solute carrier family 6 (neurotransmitter transporter), member 4, DSG1  -  desmoglein 1, PFN2  -  profilin 2, XPO1  -  exportin 1 (crm1 homolog, yeast), PTPRN  -  protein tyrosine phosphatase, receptor type, n, ATP1B1  -  atpase, na+/k+ transporting, beta 1 polypeptide, TLL1  -  tolloid-like 1, LACE1  -  lactation elevated 1, TLN1  -  talin 1, LRRK2  -  leucine-rich repeat kinase 2, CHM  -  choroideremia (rab escort protein 1), RERE  -  arginine-glutamic acid dipeptide (re) repeats, KDM5B  -  lysine (k)-specific demethylase 5b, MAP2  -  microtubule-associated protein 2, SH3KBP1  -  sh3-domain kinase binding protein 1, MAP1A  -  microtubule-associated protein 1a, DZIP1  -  daz interacting zinc finger protein 1, VPS54  -  vacuolar protein sorting 54 homolog (s. cerevisiae), AMOT  -  angiomotin, RAB6A  -  rab6a, member ras oncogene family, BRPF3  -  bromodomain and phd finger containing, 3, MBP  -  myelin basic protein, ATP6V0A1  -  atpase, h+ transporting, lysosomal v0 subunit a1, NUP43  -  nucleoporin 43kda, TMSB4X  -  thymosin beta 4, x-linked, CBX6  -  chromobox homolog 6, SKP1  -  s-phase kinase-associated protein 1, TSPYL5  -  tspy-like 5, FGD4  -  fyve, rhogef and ph domain containing 4, FAM65B  -  family with sequence similarity 65, member b, PER1  -  period circadian clock 1, GULP1  -  gulp, engulfment adaptor ptb domain containing 1, IDE  -  insulin-degrading enzyme, STON2  -  stonin 2, PI4K2A  -  phosphatidylinositol 4-kinase type 2 alpha, TTBK2  -  tau tubulin kinase 2, PFN1  -  profilin 1, SDK1  -  sidekick cell adhesion molecule 1, MYOCD  -  myocardin, CFTR  -  cystic fibrosis transmembrane conductance regulator (atp-binding cassette sub-family c, member 7), ARHGAP18  -  rho gtpase activating protein 18, CCP110  -  centriolar coiled coil protein 110kda, SLAIN2  -  slain motif family, member 2, RAB13  -  rab13, member ras oncogene family, RAN  -  ran, member ras oncogene family, SHC1  -  shc (src homology 2 domain containing) transforming protein 1, OPTC  -  opticin, GPX3  -  glutathione peroxidase 3 (plasma), ESPN  -  espin, NEDD9  -  neural precursor cell expressed, developmentally down-regulated 9, CYP26B1  -  cytochrome p450, family 26, subfamily b, polypeptide 1, TEKT5  -  tektin 5, NEFM  -  neurofilament, medium polypeptide, DHCR24  -  24-dehydrocholesterol reductase, PHGDH  -  phosphoglycerate dehydrogenase, EPC1  -  enhancer of polycomb homolog 1 (drosophila), GRB2  -  growth factor receptor-bound protein 2, TFAP4  -  transcription factor ap-4 (activating enhancer binding protein 4), CLTB  -  clathrin, light chain b, MAP1LC3B2  -  microtubule-associated protein 1 light chain 3 beta 2, CENPO  -  centromere protein o, DNAI1  -  dynein, axonemal, intermediate chain 1, SEC24C  -  sec24 family, member c (s. cerevisiae), TLN2  -  talin 2, EFHD1  -  ef-hand domain family, member d1, SYNPO  -  synaptopodin, PHACTR1  -  phosphatase and actin regulator 1, MACF1  -  microtubule-actin crosslinking factor 1, RBBP7  -  retinoblastoma binding protein 7, DYNC1H1  -  dynein, cytoplasmic 1, heavy chain 1, C15orf62  -  chromosome 15 open reading frame 62, FCHSD1  -  fch and double sh3 domains 1, IGF1R  -  insulin-like growth factor 1 receptor, LIMD1  -  lim domains containing 1, ARID4A  -  at rich interactive domain 4a (rbp1-like), SERPINB5  -  serpin peptidase inhibitor, clade b (ovalbumin), member 5, BCR  -  breakpoint cluster region, CALY  -  calcyon neuron-specific vesicular protein, F2RL3  -  coagulation factor ii (thrombin) receptor-like 3, GEMIN4  -  gem (nuclear organelle) associated protein 4, PPP6R3  -  protein phosphatase 6, regulatory subunit 3, RP1L1  -  retinitis pigmentosa 1-like 1, BCL3  -  b-cell cll/lymphoma 3, HPS4  -  hermansky-pudlak syndrome 4, PTGES3  -  prostaglandin e synthase 3 (cytosolic), BCL2  -  b-cell cll/lymphoma 2, CUL3  -  cullin 3, BCL2L1  -  bcl2-like 1, KAT6B  -  k(lysine) acetyltransferase 6b, GSK3B  -  glycogen synthase kinase 3 beta, NAA50  -  n(alpha)-acetyltransferase 50, nate catalytic subunit, NDUFS2  -  nadh dehydrogenase (ubiquinone) fe-s protein 2, 49kda (nadh-coenzyme q reductase)]
GO:0032270	positive regulation of cellular protein metabolic process	0.000503	0.103	1.36	13973	1188	933	108	[FN1  -  fibronectin 1, MAP3K8  -  mitogen-activated protein kinase kinase kinase 8, PSAP  -  prosaposin, GSN  -  gelsolin, GADD45A  -  growth arrest and dna-damage-inducible, alpha, MID1  -  midline 1 (opitz/bbb syndrome), SDC4  -  syndecan 4, VANGL2  -  vangl planar cell polarity protein 2, MAP3K7CL  -  map3k7 c-terminal like, OSM  -  oncostatin m, NAP1L2  -  nucleosome assembly protein 1-like 2, TBK1  -  tank-binding kinase 1, ENO1  -  enolase 1, (alpha), LARP4  -  la ribonucleoprotein domain family, member 4, GAREM  -  grb2 associated, regulator of mapk1, SMYD3  -  set and mynd domain containing 3, PSMA5  -  proteasome (prosome, macropain) subunit, alpha type, 5, PSMA4  -  proteasome (prosome, macropain) subunit, alpha type, 4, ASPSCR1  -  alveolar soft part sarcoma chromosome region, candidate 1, RIT2  -  ras-like without caax 2, PSMA3  -  proteasome (prosome, macropain) subunit, alpha type, 3, CHEK2  -  checkpoint kinase 2, CAB39  -  calcium binding protein 39, PSMD1  -  proteasome (prosome, macropain) 26s subunit, non-atpase, 1, PSMC5  -  proteasome (prosome, macropain) 26s subunit, atpase, 5, PRR5  -  proline rich 5 (renal), PSMD7  -  proteasome (prosome, macropain) 26s subunit, non-atpase, 7, OPRD1  -  opioid receptor, delta 1, IL6  -  interleukin 6 (interferon, beta 2), IL6R  -  interleukin 6 receptor, ITGA5  -  integrin, alpha 5 (fibronectin receptor, alpha polypeptide), PSMD12  -  proteasome (prosome, macropain) 26s subunit, non-atpase, 12, PSMD14  -  proteasome (prosome, macropain) 26s subunit, non-atpase, 14, PDGFA  -  platelet-derived growth factor alpha polypeptide, PSMD11  -  proteasome (prosome, macropain) 26s subunit, non-atpase, 11, PSME2  -  proteasome (prosome, macropain) activator subunit 2 (pa28 beta), FGF9  -  fibroblast growth factor 9, PDGFRB  -  platelet-derived growth factor receptor, beta polypeptide, SPHK1  -  sphingosine kinase 1, SQSTM1  -  sequestosome 1, MYH9  -  myosin, heavy chain 9, non-muscle, FGF1  -  fibroblast growth factor 1 (acidic), MADD  -  map-kinase activating death domain, EGFR  -  epidermal growth factor receptor, RASSF2  -  ras association (ralgds/af-6) domain family member 2, SASH1  -  sam and sh3 domain containing 1, CPEB1  -  cytoplasmic polyadenylation element binding protein 1, FZD4  -  frizzled family receptor 4, ADCY8  -  adenylate cyclase 8 (brain), LRP8  -  low density lipoprotein receptor-related protein 8, apolipoprotein e receptor, PPARG  -  peroxisome proliferator-activated receptor gamma, GPR183  -  g protein-coupled receptor 183, NEK10  -  nima-related kinase 10, ADNP  -  activity-dependent neuroprotector homeobox, SLC30A10  -  solute carrier family 30, member 10, GNG3  -  guanine nucleotide binding protein (g protein), gamma 3, HSP90AB1  -  heat shock protein 90kda alpha (cytosolic), class b member 1, AKIRIN2  -  akirin 2, CLIP3  -  cap-gly domain containing linker protein 3, MAPK12  -  mitogen-activated protein kinase 12, BTRC  -  beta-transducin repeat containing e3 ubiquitin protein ligase, PPAP2B  -  phosphatidic acid phosphatase type 2b, RB1CC1  -  rb1-inducible coiled-coil 1, KEAP1  -  kelch-like ech-associated protein 1, NRD1  -  nardilysin (n-arginine dibasic convertase), PAK6  -  p21 protein (cdc42/rac)-activated kinase 6, TIMP2  -  timp metallopeptidase inhibitor 2, IFI27  -  interferon, alpha-inducible protein 27, PFN2  -  profilin 2, TRIM67  -  tripartite motif containing 67, LRRK2  -  leucine-rich repeat kinase 2, GPLD1  -  glycosylphosphatidylinositol specific phospholipase d1, CAPRIN2  -  caprin family member 2, CHI3L1  -  chitinase 3-like 1 (cartilage glycoprotein-39), MBP  -  myelin basic protein, PEA15  -  phosphoprotein enriched in astrocytes 15, TSPYL5  -  tspy-like 5, SKP1  -  s-phase kinase-associated protein 1, DYRK1A  -  dual-specificity tyrosine-(y)-phosphorylation regulated kinase 1a, CHTOP  -  chromatin target of prmt1, TRIB2  -  tribbles homolog 2 (drosophila), CAMKK1  -  calcium/calmodulin-dependent protein kinase kinase 1, alpha, NRG1  -  neuregulin 1, UBE2K  -  ubiquitin-conjugating enzyme e2k, STK11  -  serine/threonine kinase 11, VCP  -  valosin containing protein, STK4  -  serine/threonine kinase 4, MSN  -  moesin, SHC1  -  shc (src homology 2 domain containing) transforming protein 1, EGLN3  -  egl-9 family hypoxia-inducible factor 3, LRP1  -  low density lipoprotein receptor-related protein 1, UBC  -  ubiquitin c, ADRM1  -  adhesion regulating molecule 1, TFAP4  -  transcription factor ap-4 (activating enhancer binding protein 4), BCAR3  -  breast cancer anti-estrogen resistance 3, MAP2K1  -  mitogen-activated protein kinase kinase 1, MAPK10  -  mitogen-activated protein kinase 10, TNFSF18  -  tumor necrosis factor (ligand) superfamily, member 18, PLCE1  -  phospholipase c, epsilon 1, EPHA4  -  eph receptor a4, CLCF1  -  cardiotrophin-like cytokine factor 1, BCL3  -  b-cell cll/lymphoma 3, GRM4  -  glutamate receptor, metabotropic 4, IL24  -  interleukin 24, BCL2  -  b-cell cll/lymphoma 2, CDCA2  -  cell division cycle associated 2, GSK3B  -  glycogen synthase kinase 3 beta, CCK  -  cholecystokinin]
GO:0035556	intracellular signal transduction	0.000516	0.103	1.35	13973	1254	933	113	[BNIP3  -  bcl2/adenovirus e1b 19kda interacting protein 3, SPTA1  -  spectrin, alpha, erythrocytic 1 (elliptocytosis 2), EPS8L2  -  eps8-like 2, G3BP1  -  gtpase activating protein (sh3 domain) binding protein 1, MAP3K8  -  mitogen-activated protein kinase kinase kinase 8, GSN  -  gelsolin, GADD45A  -  growth arrest and dna-damage-inducible, alpha, VANGL2  -  vangl planar cell polarity protein 2, MAP3K7CL  -  map3k7 c-terminal like, GAB2  -  grb2-associated binding protein 2, GPR56  -  g protein-coupled receptor 56, TBK1  -  tank-binding kinase 1, EPHA2  -  eph receptor a2, ANP32A  -  acidic (leucine-rich) nuclear phosphoprotein 32 family, member a, PSMA5  -  proteasome (prosome, macropain) subunit, alpha type, 5, PSMA4  -  proteasome (prosome, macropain) subunit, alpha type, 4, RIT2  -  ras-like without caax 2, PSMA3  -  proteasome (prosome, macropain) subunit, alpha type, 3, NPHP4  -  nephronophthisis 4, CHEK2  -  checkpoint kinase 2, CAB39  -  calcium binding protein 39, PSMD1  -  proteasome (prosome, macropain) 26s subunit, non-atpase, 1, RGS7  -  regulator of g-protein signaling 7, PSMC5  -  proteasome (prosome, macropain) 26s subunit, atpase, 5, PRR5  -  proline rich 5 (renal), PLCD1  -  phospholipase c, delta 1, PSMD7  -  proteasome (prosome, macropain) 26s subunit, non-atpase, 7, DOCK10  -  dedicator of cytokinesis 10, MAST1  -  microtubule associated serine/threonine kinase 1, PSMD14  -  proteasome (prosome, macropain) 26s subunit, non-atpase, 14, PDGFA  -  platelet-derived growth factor alpha polypeptide, PSMD12  -  proteasome (prosome, macropain) 26s subunit, non-atpase, 12, PSMD11  -  proteasome (prosome, macropain) 26s subunit, non-atpase, 11, SCG2  -  secretogranin ii, PSME2  -  proteasome (prosome, macropain) activator subunit 2 (pa28 beta), SCN2A  -  sodium channel, voltage-gated, type ii, alpha subunit, FGF9  -  fibroblast growth factor 9, PDGFRB  -  platelet-derived growth factor receptor, beta polypeptide, SPHK1  -  sphingosine kinase 1, SQSTM1  -  sequestosome 1, SH2D6  -  sh2 domain containing 6, FGF1  -  fibroblast growth factor 1 (acidic), ACOT11  -  acyl-coa thioesterase 11, EGFR  -  epidermal growth factor receptor, FAM65A  -  family with sequence similarity 65, member a, ADCY8  -  adenylate cyclase 8 (brain), DCLK1  -  doublecortin-like kinase 1, RHOG  -  ras homolog family member g, ARHGAP31  -  rho gtpase activating protein 31, DGKA  -  diacylglycerol kinase, alpha 80kda, MET  -  met proto-oncogene, KCTD9  -  potassium channel tetramerization domain containing 9, NLRC3  -  nlr family, card domain containing 3, LCP1  -  lymphocyte cytosolic protein 1 (l-plastin), MAPK12  -  mitogen-activated protein kinase 12, BTRC  -  beta-transducin repeat containing e3 ubiquitin protein ligase, PDE4D  -  phosphodiesterase 4d, camp-specific, NET1  -  neuroepithelial cell transforming 1, PAK6  -  p21 protein (cdc42/rac)-activated kinase 6, KCNH3  -  potassium voltage-gated channel, subfamily h (eag-related), member 3, AKT3  -  v-akt murine thymoma viral oncogene homolog 3, WNK4  -  wnk lysine deficient protein kinase 4, NR5A1  -  nuclear receptor subfamily 5, group a, member 1, SLC8A1  -  solute carrier family 8 (sodium/calcium exchanger), member 1, ATP1B1  -  atpase, na+/k+ transporting, beta 1 polypeptide, LRRK2  -  leucine-rich repeat kinase 2, CHM  -  choroideremia (rab escort protein 1), AMOT  -  angiomotin, GRAP  -  grb2-related adaptor protein, MBP  -  myelin basic protein, MT2A  -  metallothionein 2a, PEA15  -  phosphoprotein enriched in astrocytes 15, USP10  -  ubiquitin specific peptidase 10, SH2D3A  -  sh2 domain containing 3a, SKP1  -  s-phase kinase-associated protein 1, MAST2  -  microtubule associated serine/threonine kinase 2, CAMKK1  -  calcium/calmodulin-dependent protein kinase kinase 1, alpha, NRG1  -  neuregulin 1, UBE2K  -  ubiquitin-conjugating enzyme e2k, STK11  -  serine/threonine kinase 11, ARHGAP18  -  rho gtpase activating protein 18, HIC1  -  hypermethylated in cancer 1, STK4  -  serine/threonine kinase 4, RAB13  -  rab13, member ras oncogene family, SHC1  -  shc (src homology 2 domain containing) transforming protein 1, RASAL1  -  ras protein activator like 1 (gap1 like), ARTN  -  artemin, UBC  -  ubiquitin c, PIK3R1  -  phosphoinositide-3-kinase, regulatory subunit 1 (alpha), DHCR24  -  24-dehydrocholesterol reductase, GRB2  -  growth factor receptor-bound protein 2, TFAP4  -  transcription factor ap-4 (activating enhancer binding protein 4), BCAR3  -  breast cancer anti-estrogen resistance 3, MAP2K1  -  mitogen-activated protein kinase kinase 1, MAPK10  -  mitogen-activated protein kinase 10, C15orf62  -  chromosome 15 open reading frame 62, GRIN2B  -  glutamate receptor, ionotropic, n-methyl d-aspartate 2b, STAC3  -  sh3 and cysteine rich domain 3, IGF1R  -  insulin-like growth factor 1 receptor, ARL13A  -  adp-ribosylation factor-like 13a, SRPK1  -  srsf protein kinase 1, PLCE1  -  phospholipase c, epsilon 1, BCR  -  breakpoint cluster region, DEPDC5  -  dep domain containing 5, CLCF1  -  cardiotrophin-like cytokine factor 1, RP1L1  -  retinitis pigmentosa 1-like 1, BCL3  -  b-cell cll/lymphoma 3, BCL2  -  b-cell cll/lymphoma 2, CUL3  -  cullin 3, BCL2L1  -  bcl2-like 1, ARHGAP30  -  rho gtpase activating protein 30, GSK3B  -  glycogen synthase kinase 3 beta, RREB1  -  ras responsive element binding protein 1]
GO:0019882	antigen processing and presentation	0.000521	0.103	2.2	13973	143	933	21	[RAB6A  -  rab6a, member ras oncogene family, PSMD14  -  proteasome (prosome, macropain) 26s subunit, non-atpase, 14, PSMD12  -  proteasome (prosome, macropain) 26s subunit, non-atpase, 12, MARCH1  -  membrane-associated ring finger (c3hc4) 1, e3 ubiquitin protein ligase, PSMD11  -  proteasome (prosome, macropain) 26s subunit, non-atpase, 11, DYNC1H1  -  dynein, cytoplasmic 1, heavy chain 1, AP1G1  -  adaptor-related protein complex 1, gamma 1 subunit, PSMA5  -  proteasome (prosome, macropain) subunit, alpha type, 5, PSME2  -  proteasome (prosome, macropain) activator subunit 2 (pa28 beta), PSMA4  -  proteasome (prosome, macropain) subunit, alpha type, 4, PSMA3  -  proteasome (prosome, macropain) subunit, alpha type, 3, DCTN2  -  dynactin 2 (p50), CANX  -  calnexin, SEC24D  -  sec24 family, member d (s. cerevisiae), PSMD1  -  proteasome (prosome, macropain) 26s subunit, non-atpase, 1, DCTN1  -  dynactin 1, PSMC5  -  proteasome (prosome, macropain) 26s subunit, atpase, 5, ACTR1B  -  arp1 actin-related protein 1 homolog b, centractin beta (yeast), AP1S2  -  adaptor-related protein complex 1, sigma 2 subunit, PSMD7  -  proteasome (prosome, macropain) 26s subunit, non-atpase, 7, SEC24C  -  sec24 family, member c (s. cerevisiae)]
