GO Term	Description	P-value	FDR q-value	Enrichment	N	B	n	b	Genes
GO:0022603	regulation of anatomical structure morphogenesis	0.000000058	0.000833	1.76	13973	784	933	92	[SPTA1  -  spectrin, alpha, erythrocytic 1 (elliptocytosis 2), BNIP3  -  bcl2/adenovirus e1b 19kda interacting protein 3, MMRN2  -  multimerin 2, FN1  -  fibronectin 1, SSH1  -  slingshot protein phosphatase 1, RUFY3  -  run and fyve domain containing 3, ARHGAP15  -  rho gtpase activating protein 15, GSN  -  gelsolin, VANGL2  -  vangl planar cell polarity protein 2, CORO1C  -  coronin, actin binding protein, 1c, ANXA7  -  annexin a7, LRRK2  -  leucine-rich repeat kinase 2, MAP2  -  microtubule-associated protein 2, SH3KBP1  -  sh3-domain kinase binding protein 1, AMOT  -  angiomotin, LARP4  -  la ribonucleoprotein domain family, member 4, CAPRIN2  -  caprin family member 2, CHI3L1  -  chitinase 3-like 1 (cartilage glycoprotein-39), EPHA2  -  eph receptor a2, MBP  -  myelin basic protein, KRT1  -  keratin 1, CEACAM1  -  carcinoembryonic antigen-related cell adhesion molecule 1 (biliary glycoprotein), MYOD1  -  myogenic differentiation 1, CDC42SE1  -  cdc42 small effector 1, PSMA5  -  proteasome (prosome, macropain) subunit, alpha type, 5, MYOG  -  myogenin (myogenic factor 4), PSMA4  -  proteasome (prosome, macropain) subunit, alpha type, 4, PSMA3  -  proteasome (prosome, macropain) subunit, alpha type, 3, FGD4  -  fyve, rhogef and ph domain containing 4, FAM65B  -  family with sequence similarity 65, member b, GRHL3  -  grainyhead-like 3 (drosophila), PSMD1  -  proteasome (prosome, macropain) 26s subunit, non-atpase, 1, PAFAH1B1  -  platelet-activating factor acetylhydrolase 1b, regulatory subunit 1 (45kda), NRG1  -  neuregulin 1, PSMC5  -  proteasome (prosome, macropain) 26s subunit, atpase, 5, TTBK2  -  tau tubulin kinase 2, TMBIM1  -  transmembrane bax inhibitor motif containing 1, OMG  -  oligodendrocyte myelin glycoprotein, VASH1  -  vasohibin 1, PFN1  -  profilin 1, VAT1  -  vesicle amine transport protein 1 homolog (t. californica), PSMD7  -  proteasome (prosome, macropain) 26s subunit, non-atpase, 7, FGR  -  feline gardner-rasheed sarcoma viral oncogene homolog, STK11  -  serine/threonine kinase 11, ARHGAP18  -  rho gtpase activating protein 18, IL6  -  interleukin 6 (interferon, beta 2), MSN  -  moesin, CELA1  -  chymotrypsin-like elastase family, member 1, PSMD14  -  proteasome (prosome, macropain) 26s subunit, non-atpase, 14, PDGFA  -  platelet-derived growth factor alpha polypeptide, PSMD12  -  proteasome (prosome, macropain) 26s subunit, non-atpase, 12, ITGA5  -  integrin, alpha 5 (fibronectin receptor, alpha polypeptide), PSMD11  -  proteasome (prosome, macropain) 26s subunit, non-atpase, 11, PSME2  -  proteasome (prosome, macropain) activator subunit 2 (pa28 beta), RASAL1  -  ras protein activator like 1 (gap1 like), GPC6  -  glypican 6, FMNL1  -  formin-like 1, SPHK1  -  sphingosine kinase 1, AJAP1  -  adherens junctions associated protein 1, UBC  -  ubiquitin c, MYH9  -  myosin, heavy chain 9, non-muscle, ALDOA  -  aldolase a, fructose-bisphosphate, ERG  -  v-ets avian erythroblastosis virus e26 oncogene homolog, CCR3  -  chemokine (c-c motif) receptor 3, FGF1  -  fibroblast growth factor 1 (acidic), SSH3  -  slingshot protein phosphatase 3, NEDD4L  -  neural precursor cell expressed, developmentally down-regulated 4-like, e3 ubiquitin protein ligase, SASH1  -  sam and sh3 domain containing 1, SYT2  -  synaptotagmin ii, PRPF40A  -  prp40 pre-mrna processing factor 40 homolog a (s. cerevisiae), FZD4  -  frizzled family receptor 4, LRP8  -  low density lipoprotein receptor-related protein 8, apolipoprotein e receptor, MAP2K1  -  mitogen-activated protein kinase kinase 1, MACF1  -  microtubule-actin crosslinking factor 1, ADNP  -  activity-dependent neuroprotector homeobox, C15orf62  -  chromosome 15 open reading frame 62, ARAP3  -  arfgap with rhogap domain, ankyrin repeat and ph domain 3, EPB41  -  erythrocyte membrane protein band 4.1 (elliptocytosis 1, rh-linked), SRPX2  -  sushi-repeat containing protein, x-linked 2, LIMD1  -  lim domains containing 1, MMP20  -  matrix metallopeptidase 20, BCR  -  breakpoint cluster region, EPHA4  -  eph receptor a4, S100A10  -  s100 calcium binding protein a10, BAMBI  -  bmp and activin membrane-bound inhibitor, HTATIP2  -  hiv-1 tat interactive protein 2, 30kda, SMCR7  -  smith-magenis syndrome chromosome region, candidate 7, BCL2  -  b-cell cll/lymphoma 2, ANXA1  -  annexin a1, RTN4  -  reticulon 4, NET1  -  neuroepithelial cell transforming 1, RREB1  -  ras responsive element binding protein 1]
GO:0030334	regulation of cell migration	0.000000488	0.0035	1.85	13973	560	933	69	[ZMYND8  -  zinc finger, mynd-type containing 8, MMRN2  -  multimerin 2, GSTP1  -  glutathione s-transferase pi 1, FN1  -  fibronectin 1, SSH1  -  slingshot protein phosphatase 1, RUFY3  -  run and fyve domain containing 3, ARHGEF39  -  rho guanine nucleotide exchange factor (gef) 39, PFN2  -  profilin 2, GSN  -  gelsolin, SLC8A1  -  solute carrier family 8 (sodium/calcium exchanger), member 1, CD274  -  cd274 molecule, SDC4  -  syndecan 4, CORO1C  -  coronin, actin binding protein, 1c, FSHB  -  follicle stimulating hormone, beta polypeptide, PTPN23  -  protein tyrosine phosphatase, non-receptor type 23, CLIC4  -  chloride intracellular channel 4, GPLD1  -  glycosylphosphatidylinositol specific phospholipase d1, GPR56  -  g protein-coupled receptor 56, AMOT  -  angiomotin, EPHA2  -  eph receptor a2, CEACAM1  -  carcinoembryonic antigen-related cell adhesion molecule 1 (biliary glycoprotein), TMSB4X  -  thymosin beta 4, x-linked, RFFL  -  ring finger and fyve-like domain containing e3 ubiquitin protein ligase, FAM65B  -  family with sequence similarity 65, member b, IL1R1  -  interleukin 1 receptor, type i, LMO4  -  lim domain only 4, CAPN7  -  calpain 7, NRG1  -  neuregulin 1, VASH1  -  vasohibin 1, PHLDA2  -  pleckstrin homology-like domain, family a, member 2, PFN1  -  profilin 1, MYOCD  -  myocardin, FGR  -  feline gardner-rasheed sarcoma viral oncogene homolog, DOCK10  -  dedicator of cytokinesis 10, CREB3  -  camp responsive element binding protein 3, DUSP10  -  dual specificity phosphatase 10, IL6  -  interleukin 6 (interferon, beta 2), IL6R  -  interleukin 6 receptor, MSN  -  moesin, ITGA5  -  integrin, alpha 5 (fibronectin receptor, alpha polypeptide), PDGFA  -  platelet-derived growth factor alpha polypeptide, LRP1  -  low density lipoprotein receptor-related protein 1, PDGFRB  -  platelet-derived growth factor receptor, beta polypeptide, SPHK1  -  sphingosine kinase 1, ITGA2B  -  integrin, alpha 2b (platelet glycoprotein iib of iib/iiia complex, antigen cd41), PIK3R1  -  phosphoinositide-3-kinase, regulatory subunit 1 (alpha), FGF1  -  fibroblast growth factor 1 (acidic), FAM83H  -  family with sequence similarity 83, member h, PLAU  -  plasminogen activator, urokinase, EGFR  -  epidermal growth factor receptor, SASH1  -  sam and sh3 domain containing 1, CPEB1  -  cytoplasmic polyadenylation element binding protein 1, FAM65A  -  family with sequence similarity 65, member a, MACF1  -  microtubule-actin crosslinking factor 1, SCRT2  -  scratch homolog 2, zinc finger protein (drosophila), GPR183  -  g protein-coupled receptor 183, ARAP3  -  arfgap with rhogap domain, ankyrin repeat and ph domain 3, IGF1R  -  insulin-like growth factor 1 receptor, SRPX2  -  sushi-repeat containing protein, x-linked 2, MET  -  met proto-oncogene, TNFSF18  -  tumor necrosis factor (ligand) superfamily, member 18, BCR  -  breakpoint cluster region, IL24  -  interleukin 24, BCL2  -  b-cell cll/lymphoma 2, ANXA1  -  annexin a1, RTN4  -  reticulon 4, LAMA3  -  laminin, alpha 3, RREB1  -  ras responsive element binding protein 1, LAMB1  -  laminin, beta 1]
GO:2000145	regulation of cell motility	0.00000356	0.017	1.74	13973	603	933	70	[ZMYND8  -  zinc finger, mynd-type containing 8, MMRN2  -  multimerin 2, GSTP1  -  glutathione s-transferase pi 1, FN1  -  fibronectin 1, SSH1  -  slingshot protein phosphatase 1, RUFY3  -  run and fyve domain containing 3, ARHGEF39  -  rho guanine nucleotide exchange factor (gef) 39, PFN2  -  profilin 2, GSN  -  gelsolin, SLC8A1  -  solute carrier family 8 (sodium/calcium exchanger), member 1, CD274  -  cd274 molecule, SDC4  -  syndecan 4, CORO1C  -  coronin, actin binding protein, 1c, FSHB  -  follicle stimulating hormone, beta polypeptide, PTPN23  -  protein tyrosine phosphatase, non-receptor type 23, CLIC4  -  chloride intracellular channel 4, GPLD1  -  glycosylphosphatidylinositol specific phospholipase d1, GPR56  -  g protein-coupled receptor 56, AMOT  -  angiomotin, EPHA2  -  eph receptor a2, CEACAM1  -  carcinoembryonic antigen-related cell adhesion molecule 1 (biliary glycoprotein), TMSB4X  -  thymosin beta 4, x-linked, RFFL  -  ring finger and fyve-like domain containing e3 ubiquitin protein ligase, FAM65B  -  family with sequence similarity 65, member b, IL1R1  -  interleukin 1 receptor, type i, LMO4  -  lim domain only 4, CAPN7  -  calpain 7, NRG1  -  neuregulin 1, VASH1  -  vasohibin 1, PHLDA2  -  pleckstrin homology-like domain, family a, member 2, PFN1  -  profilin 1, MYOCD  -  myocardin, FGR  -  feline gardner-rasheed sarcoma viral oncogene homolog, DOCK10  -  dedicator of cytokinesis 10, CREB3  -  camp responsive element binding protein 3, ARHGAP18  -  rho gtpase activating protein 18, DUSP10  -  dual specificity phosphatase 10, IL6  -  interleukin 6 (interferon, beta 2), IL6R  -  interleukin 6 receptor, MSN  -  moesin, ITGA5  -  integrin, alpha 5 (fibronectin receptor, alpha polypeptide), PDGFA  -  platelet-derived growth factor alpha polypeptide, LRP1  -  low density lipoprotein receptor-related protein 1, PDGFRB  -  platelet-derived growth factor receptor, beta polypeptide, SPHK1  -  sphingosine kinase 1, ITGA2B  -  integrin, alpha 2b (platelet glycoprotein iib of iib/iiia complex, antigen cd41), PIK3R1  -  phosphoinositide-3-kinase, regulatory subunit 1 (alpha), FGF1  -  fibroblast growth factor 1 (acidic), FAM83H  -  family with sequence similarity 83, member h, PLAU  -  plasminogen activator, urokinase, EGFR  -  epidermal growth factor receptor, SASH1  -  sam and sh3 domain containing 1, CPEB1  -  cytoplasmic polyadenylation element binding protein 1, FAM65A  -  family with sequence similarity 65, member a, MACF1  -  microtubule-actin crosslinking factor 1, SCRT2  -  scratch homolog 2, zinc finger protein (drosophila), GPR183  -  g protein-coupled receptor 183, ARAP3  -  arfgap with rhogap domain, ankyrin repeat and ph domain 3, IGF1R  -  insulin-like growth factor 1 receptor, SRPX2  -  sushi-repeat containing protein, x-linked 2, MET  -  met proto-oncogene, TNFSF18  -  tumor necrosis factor (ligand) superfamily, member 18, BCR  -  breakpoint cluster region, IL24  -  interleukin 24, BCL2  -  b-cell cll/lymphoma 2, ANXA1  -  annexin a1, RTN4  -  reticulon 4, LAMA3  -  laminin, alpha 3, RREB1  -  ras responsive element binding protein 1, LAMB1  -  laminin, beta 1]
GO:0040012	regulation of locomotion	0.00000593	0.0213	1.68	13973	658	933	74	[ZMYND8  -  zinc finger, mynd-type containing 8, MMRN2  -  multimerin 2, GSTP1  -  glutathione s-transferase pi 1, FN1  -  fibronectin 1, SSH1  -  slingshot protein phosphatase 1, RUFY3  -  run and fyve domain containing 3, ARHGEF39  -  rho guanine nucleotide exchange factor (gef) 39, GSN  -  gelsolin, PFN2  -  profilin 2, SLC8A1  -  solute carrier family 8 (sodium/calcium exchanger), member 1, CD274  -  cd274 molecule, SDC4  -  syndecan 4, CORO1C  -  coronin, actin binding protein, 1c, FSHB  -  follicle stimulating hormone, beta polypeptide, PTPN23  -  protein tyrosine phosphatase, non-receptor type 23, LRRK2  -  leucine-rich repeat kinase 2, CLIC4  -  chloride intracellular channel 4, GPLD1  -  glycosylphosphatidylinositol specific phospholipase d1, GPR56  -  g protein-coupled receptor 56, AMOT  -  angiomotin, USP14  -  ubiquitin specific peptidase 14 (trna-guanine transglycosylase), EPHA2  -  eph receptor a2, CEACAM1  -  carcinoembryonic antigen-related cell adhesion molecule 1 (biliary glycoprotein), TMSB4X  -  thymosin beta 4, x-linked, RFFL  -  ring finger and fyve-like domain containing e3 ubiquitin protein ligase, FAM65B  -  family with sequence similarity 65, member b, IL1R1  -  interleukin 1 receptor, type i, LMO4  -  lim domain only 4, CAPN7  -  calpain 7, NRG1  -  neuregulin 1, VASH1  -  vasohibin 1, PHLDA2  -  pleckstrin homology-like domain, family a, member 2, PFN1  -  profilin 1, MYOCD  -  myocardin, FGR  -  feline gardner-rasheed sarcoma viral oncogene homolog, DOCK10  -  dedicator of cytokinesis 10, CREB3  -  camp responsive element binding protein 3, ARHGAP18  -  rho gtpase activating protein 18, DUSP10  -  dual specificity phosphatase 10, IL6  -  interleukin 6 (interferon, beta 2), IL6R  -  interleukin 6 receptor, MSN  -  moesin, ITGA5  -  integrin, alpha 5 (fibronectin receptor, alpha polypeptide), PDGFA  -  platelet-derived growth factor alpha polypeptide, SCG2  -  secretogranin ii, LRP1  -  low density lipoprotein receptor-related protein 1, ARTN  -  artemin, PDGFRB  -  platelet-derived growth factor receptor, beta polypeptide, SPHK1  -  sphingosine kinase 1, ITGA2B  -  integrin, alpha 2b (platelet glycoprotein iib of iib/iiia complex, antigen cd41), PIK3R1  -  phosphoinositide-3-kinase, regulatory subunit 1 (alpha), FGF1  -  fibroblast growth factor 1 (acidic), FAM83H  -  family with sequence similarity 83, member h, PLAU  -  plasminogen activator, urokinase, EGFR  -  epidermal growth factor receptor, SASH1  -  sam and sh3 domain containing 1, CPEB1  -  cytoplasmic polyadenylation element binding protein 1, FAM65A  -  family with sequence similarity 65, member a, MACF1  -  microtubule-actin crosslinking factor 1, SCRT2  -  scratch homolog 2, zinc finger protein (drosophila), GPR183  -  g protein-coupled receptor 183, ARAP3  -  arfgap with rhogap domain, ankyrin repeat and ph domain 3, IGF1R  -  insulin-like growth factor 1 receptor, SRPX2  -  sushi-repeat containing protein, x-linked 2, MET  -  met proto-oncogene, TNFSF18  -  tumor necrosis factor (ligand) superfamily, member 18, BCR  -  breakpoint cluster region, IL24  -  interleukin 24, BCL2  -  b-cell cll/lymphoma 2, ANXA1  -  annexin a1, RTN4  -  reticulon 4, LAMA3  -  laminin, alpha 3, RREB1  -  ras responsive element binding protein 1, LAMB1  -  laminin, beta 1]
GO:0007010	cytoskeleton organization	0.0000171	0.0246	1.67	13973	608	933	68	[DST  -  dystonin, CAPN6  -  calpain 6, SSH1  -  slingshot protein phosphatase 1, FRMD3  -  ferm domain containing 3, SPIRE1  -  spire actin nucleation factor 1, PFN2  -  profilin 2, ABLIM1  -  actin binding lim protein 1, MID1  -  midline 1 (opitz/bbb syndrome), CORO1C  -  coronin, actin binding protein, 1c, TLN1  -  talin 1, DCTN1  -  dynactin 1, MAP2  -  microtubule-associated protein 2, SH3KBP1  -  sh3-domain kinase binding protein 1, PACSIN2  -  protein kinase c and casein kinase substrate in neurons 2, MAP1A  -  microtubule-associated protein 1a, SVIL  -  supervillin, VPS54  -  vacuolar protein sorting 54 homolog (s. cerevisiae), AMOT  -  angiomotin, LARP4  -  la ribonucleoprotein domain family, member 4, TUBB2A  -  tubulin, beta 2a class iia, XIRP1  -  xin actin-binding repeat containing 1, NPHP4  -  nephronophthisis 4, FGD4  -  fyve, rhogef and ph domain containing 4, MAST2  -  microtubule associated serine/threonine kinase 2, CHEK2  -  checkpoint kinase 2, PAFAH1B1  -  platelet-activating factor acetylhydrolase 1b, regulatory subunit 1 (45kda), TMOD4  -  tropomodulin 4 (muscle), PFN1  -  profilin 1, TUBA1C  -  tubulin, alpha 1c, MAST1  -  microtubule associated serine/threonine kinase 1, TRDN  -  triadin, RAB13  -  rab13, member ras oncogene family, MSN  -  moesin, SLAIN2  -  slain motif family, member 2, PDGFA  -  platelet-derived growth factor alpha polypeptide, KRT31  -  keratin 31, RAN  -  ran, member ras oncogene family, SHC1  -  shc (src homology 2 domain containing) transforming protein 1, DCTN2  -  dynactin 2 (p50), PDGFRB  -  platelet-derived growth factor receptor, beta polypeptide, FMNL1  -  formin-like 1, NEDD9  -  neural precursor cell expressed, developmentally down-regulated 9, MYH9  -  myosin, heavy chain 9, non-muscle, NEFM  -  neurofilament, medium polypeptide, LIMCH1  -  lim and calponin homology domains 1, FAM83H  -  family with sequence similarity 83, member h, PRPF40A  -  prp40 pre-mrna processing factor 40 homolog a (s. cerevisiae), TLN2  -  talin 2, PHACTR1  -  phosphatase and actin regulator 1, MYBPH  -  myosin binding protein h, RHOG  -  ras homolog family member g, KRT18  -  keratin 18, DYNC1H1  -  dynein, cytoplasmic 1, heavy chain 1, ARAP3  -  arfgap with rhogap domain, ankyrin repeat and ph domain 3, ADD3  -  adducin 3 (gamma), EPB41L1  -  erythrocyte membrane protein band 4.1-like 1, EPB41  -  erythrocyte membrane protein band 4.1 (elliptocytosis 1, rh-linked), LIMD1  -  lim domains containing 1, PLCE1  -  phospholipase c, epsilon 1, BCR  -  breakpoint cluster region, TUBGCP3  -  tubulin, gamma complex associated protein 3, RP1L1  -  retinitis pigmentosa 1-like 1, GAPDH  -  glyceraldehyde-3-phosphate dehydrogenase, CLIP1  -  cap-gly domain containing linker protein 1, CUL3  -  cullin 3, ANXA1  -  annexin a1, PAK6  -  p21 protein (cdc42/rac)-activated kinase 6, ZNF207  -  zinc finger protein 207]
GO:0022604	regulation of cell morphogenesis	0.0000198	0.0258	1.9	13973	363	933	46	[SPTA1  -  spectrin, alpha, erythrocytic 1 (elliptocytosis 2), FN1  -  fibronectin 1, SSH1  -  slingshot protein phosphatase 1, RUFY3  -  run and fyve domain containing 3, RASAL1  -  ras protein activator like 1 (gap1 like), ARHGAP15  -  rho gtpase activating protein 15, FMNL1  -  formin-like 1, ALDOA  -  aldolase a, fructose-bisphosphate, MYH9  -  myosin, heavy chain 9, non-muscle, CORO1C  -  coronin, actin binding protein, 1c, ANXA7  -  annexin a7, SSH3  -  slingshot protein phosphatase 3, LRRK2  -  leucine-rich repeat kinase 2, NEDD4L  -  neural precursor cell expressed, developmentally down-regulated 4-like, e3 ubiquitin protein ligase, MAP2  -  microtubule-associated protein 2, SYT2  -  synaptotagmin ii, PRPF40A  -  prp40 pre-mrna processing factor 40 homolog a (s. cerevisiae), SH3KBP1  -  sh3-domain kinase binding protein 1, LRP8  -  low density lipoprotein receptor-related protein 8, apolipoprotein e receptor, MAP2K1  -  mitogen-activated protein kinase kinase 1, MACF1  -  microtubule-actin crosslinking factor 1, LARP4  -  la ribonucleoprotein domain family, member 4, CAPRIN2  -  caprin family member 2, ADNP  -  activity-dependent neuroprotector homeobox, C15orf62  -  chromosome 15 open reading frame 62, ARAP3  -  arfgap with rhogap domain, ankyrin repeat and ph domain 3, CDC42SE1  -  cdc42 small effector 1, EPB41  -  erythrocyte membrane protein band 4.1 (elliptocytosis 1, rh-linked), LIMD1  -  lim domains containing 1, FGD4  -  fyve, rhogef and ph domain containing 4, EPHA4  -  eph receptor a4, S100A10  -  s100 calcium binding protein a10, BAMBI  -  bmp and activin membrane-bound inhibitor, PAFAH1B1  -  platelet-activating factor acetylhydrolase 1b, regulatory subunit 1 (45kda), NRG1  -  neuregulin 1, TTBK2  -  tau tubulin kinase 2, OMG  -  oligodendrocyte myelin glycoprotein, ANXA1  -  annexin a1, RTN4  -  reticulon 4, NET1  -  neuroepithelial cell transforming 1, FGR  -  feline gardner-rasheed sarcoma viral oncogene homolog, STK11  -  serine/threonine kinase 11, ARHGAP18  -  rho gtpase activating protein 18, RREB1  -  ras responsive element binding protein 1, IL6  -  interleukin 6 (interferon, beta 2), MSN  -  moesin]
